<?xml version="1.0" encoding="UTF-8"?>
<p:Akt xmlns:p="http://www.parlament.gov.rs/propisi"
 xmlns:ns1="http://www.parlament.gov.rs/generic_types"
 xmlns:xsi="http://www.w3.org/2001/XMLSchema-instance"
 xsi:schemaLocation="http://www.parlament.gov.rs/propisi file:/home/nina/Desktop/XML%20i%20Web%20servisi/xml/proj/xml/materijali/schema/akt.xsd" status="donet">
    <p:Sporedni_deo>
        <p:Akt_u_proceduri>
            <p:Predlagac>
            </p:Predlagac>
            <p:Upucuje_se>
            </p:Upucuje_se>
        </p:Akt_u_proceduri>
    </p:Sporedni_deo>
    <p:Glavni_deo>
        <p:Clan>
            <p:Sadrzaj/>
        </p:Clan>
    </p:Glavni_deo>
</p:Akt>
